{
  "$schema": "../../../automation/delivery-plan.schema.json",
  "schemaVersion": 1,
  "changeId": "change-id",
  "projectId": "PRJ-001",
  "businessDomain": "SALES",
  "externalPublishingEnabled": false,
  "ticketing": {
    "required": true,
    "epic": {
      "mode": "existing",
      "sourceId": "EPIC-SALES",
      "title": "Sales"
    },
    "storiesFrom": "requirements",
    "tasksFrom": "tasks"
  },
  "uat": {
    "required": true
  },
  "documentation": {
    "required": true,
    "confluenceStylePages": true,
    "spaceAlias": "bc-enterprise"
  },
  "training": {
    "required": false,
    "purpose": "",
    "audiences": []
  },
  "release": {
    "required": true
  }
}
